County;Agency_Name;Trading_Name;Address;Licence_Number;Phone;Email;Website;Covered_Fields
Dublin;Eteam Workforce Limited;;6-9 Trinity Street Dublin 2 D02 EY47;EA4240;3539087570800;emeainfo@eteaminc.com;https://eteaminc.com;IT & Data Science, General Recruitment, Admin & Office
Dublin;Europlan Personnel Services Limited;;Parkview House, Unit 2B Beechhill Office Campus Clonskeagh, Dublin 4;EA1120;35312606578;info@europlanservices.com;https://europlanservices.com;Admin & Office, Accounting & Finance, General Recruitment, IT & Data Science
Dublin;Evolution Care Solutions Limited;;Omega House Collinstown Co. Dublin K67EOA8;EA4811;35315727045;info@evolutioncare.ie;https://evolutioncare.ie/;Care & Healthcare
Dublin;Exactest Ltd;Exactest;51/52 Fitzwilliam Square West Dublin 2;EA4357;35315563040;info@exactest.ie;https://exactest.ie;IT & Data Science, QA
Dublin;Excel Aviation Limited;;Broadmeadow Hall Applewood Village Swords Co. Dublin;EA3666;35318131916;admin@excelaviation.ie;https://ExcelAviation.ie;Aviation
Dublin;Executive Edge Limited;;Suite 2017 Orchard Avenue Citywest Business Campus Co. Dublin D24 RHY6;EA1680;35314663983;info@executiveedge.ie;https://executiveedge.ie;Admin & Office, HR, Sales & Marketing, Accounting & Finance
Dublin;Expleo Technology Ireland Ltd;Expleo Technology Ireland Ltd;30 North Wall Quay IFSC Dublin 1 DO1R8H7;EA5278;35316709916;;https://expleo.com/global/en/;Engineering, IT & Data Science
Dublin;Exthras-Professional Staff Solutions;Exthras;13 Adelaide Road Dublin 2 D02P950;EA5296;353892556556;;;Hospitality, Cleaning Services, Care & Healthcare
Dublin;Ezra Placement Limited;;6 The Grange Kill Lane Blackrock Co. Dublin A94 A5D2;EA4967;+353872897945 | +353894318634;info@ezraplacement.com;https://ezraplacement.com;Care & Healthcare, Cleaning Services
Dublin;F2R-First 2 Rescource Limited;;One Earlsfort Centre Lower Hatch Street Dublin 2;EA5332;;info@first2resource.com;https://first2resource.com/;Hospitality, Retail, Admin & Office
Dublin;Facilitas Management Limited;Facilitas Management;10B Santry Business park Santry Dublin 9;EA3750;353862719233;info@facilitas.ie;https://facilitas.ie;Facilities, Cleaning Services, Security
Dublin;Fahy Kelly International Limited;FK International;Pembroke Hall 38-39 Fitzwilliam Square Dublin 2 D02NX53;EA1149;35316688060;info@fkinternational.com;https://www.fkinternational.com/;Accounting & Finance, Banking
Dublin;Fingal Language Institute Limited;Dalmac Recruitment & Aviation Services;19 Grange Parade Baldoyle Industrial Estate Dublin 13 D13N29X;EA1511;35318437127;;https://dalmac.ie/;Aviation, Education
Dublin;Fionn Healthcare Ltd;;17 Maypark Malahide Road Dublin 5 D05Y4T8;EA4833;;;https://fionnhr.ie/;Care & Healthcare
Dublin;Firstaff Personnel Consultants Limited;;85-86 Grafton Street Dublin 2 D02 Y248;EA1002;35316797766;angelad@firstaff.ie;https://firstaff.ie;Board Level, Admin & Office, IT & Data Science, Accounting & Finance
Dublin;Fitzwilliam Executive Search Limited;ICDS Recruitment Consultants;24 Upper Fitzwilliam St Dublin 2 D02N883;EA3657;35316321200;info@icds.ie;https://recruitment.icds.ie/;Construction, Engineering, Board Level
Dublin;Fraser Models and Actors Limited;;11 Herbert Street Dublin 2;EA3637;35316624814;hello@fraser.ie;https://fraser.ie;Acting
Dublin;Furzeside Limited;GPC Finance;Unit 511, Q House Furze Road Sandyford Business Park Dublin 18 D18 YW88;EA4490;35312078990; recruit@gpfinance.com;;Accounting & Finance, Construction
Dublin;Future Direct Professional Services Limited;Future Direct;6 Fern Road Sandyford Business Park Sandyford Dublin 18 D18FP98;EA5324;35315134085;info@futuredirect.ie;https://www.futuredirect.ie;Cleaning Services, Facilities, Care & Healthcare
Dublin;Future Home Care Specialist Ltd;;5 Fitzwilliam Sq Dublin 2;EA4841;35319026555;info@futurecare.ie;https://futurecare.ie;Care & Healthcare
Dublin;FX2 Recruitment Limited;;6-9 Trinity Street Dublin 2 D02 EY47;EA3405;35316121410;;https://www.fx2recruitment.com/;Care & Healthcare, Hospitality, Admin & Office
Dublin;Gateway Recruitment Limited;Gateway Recruitment Limited;6 - 9 Trinity Street Dublin 2;EA3882;;contactus@gatewayrecruitment.ie;https://www.gatewayrecruitment.ie/job-search;Admin & Office, Cleaning Services, Retail
Dublin;Gecare Staffing Agency Limited;Gecare Staffing Agency;77 Camden Street Lower Saint Kevin's Dublin 2 D02 XE80;EA4507;353899747951;;https://www.gecarestaffing.com;Care & Healthcare
Dublin;Gempool Limited;GemPool;The Arch, Block 3, Blackrock Business Park Blackrock Co. Dublin;EA3546;35319136804;info@gempool.ie;https://gempool.ie;IT & Data Science
Dublin;Gencat LTD;Gencat;18H Rosemount Park Drive Rosemount Business Park Ballycoolin Dublin 11 D11 EFR5;EA4325;353872631440;info@gencat.ie;https://gencat.ie/;Construction, Engineering, Energy Sector
Dublin;GHL Recruitment Limited;;124 Lower Baggot Street Dublin 2;EA1520;35316610911;info@ghl.ie;https://www.ghl.ie;Admin & Office, HR, Legal
Dublin;Gibbs Hybrid (Ireland) Limited;Gibbs Hybrid Ireland;The Masonry 151-156 Thomas Street Dublin 9;EA4220;;;;General Recruitment, IT & Data Science, Admin & Office
Dublin;Gilligan Black Recruitment Ltd;Gilligan Black Recruitment;39 Leeson Street Lower Dublin 2;EA2231;35317999100;info@gilliganblack.ie;https://gilliganblack.ie/;Admin & Office, Sales & Marketing, Legal
Dublin;Global Labour & Facilities Ltd;;Unit 2A Nangor Road Business Park Nangor Road Dublin 12;EA3955;+35316204578 | +353860261609;brian@globallabourforce.com;https://www.glf-ireland.com/;General Recruitment, Facilities, Cleaning Services
Dublin;Global Sights Innovation Ltd;Global Care;51 Bracken Road Sandyford Dublin 18;EA5047;353899896178;;;Care & Healthcare, General Recruitment, Care
Dublin;GlobalForce Resource Ltd;;13 Hampton Park St Helens Wood Booterstown Co. Dublin A94 H567;EA3535;35312104526;info@globalforceresource.com;https://globalforceresource.com;Automotive, Factory, General Recruitment
Dublin;Globalization Partners Ireland Consulting Limited;;104 Lower Baggot Street Dublin 2 D02Y940;EA4104;;jmcguire@globalization-partners.com;https://www.globalization-partners.com/;HR, Remote
Dublin;GoGlobal BCS Europe Limited;;1st Floor The Liffey Trust Centre 117 - 126 Sheriff Street Upper Dublin 1 D01YC43;EA5241;;;;Employer of Record, HR
Dublin;Greg O'Hanlon International Limited;;36 Fitzwilliam Square Dublin 2;EA4429;353876003620;;;Factory, Technical, Supply Chain
Dublin;Grey Wave (Recruitment) Limited;Grey Wave Work Hub;77 Camden Street Lower Dublin 2;EA4536;;info@grey-wave.com | marc@grey-wave.com;https://grey-wave.com;General Recruitment, Coaching
Dublin;Greysea Recruitment Ltd;;8 The Mall Lucan Co. Dublin;EA5079;353892770216;info@greysearecruitment.ie;https://greysearecruitment.ie;Hospitality, Cleaning Services, Admin & Office
Dublin;GS Agri Recruitment Ltd;GS International Recruitment;Glencullen House Kylemore Road Inchicore Dublin 10 D10 K729;EA4175;353864120773;info@gsrecruit.com;https://gsrecruit.com;Agriculture, Factory, General Recruitment
Dublin;Hadfield Green Limited;Hadfield Green;WeWork 2 Dublin Landings North Dock Co. Dublin D01V4A3;EA4413;353861580178;info@hadfieldgreen.com;https://www.hadfieldgreen.com/;ESG, General Recruitment
Dublin;Hans People Limited;Hans People Limited;13 Rathfarnham Road Terenure Road Co. Dublin D6W DK49;EA5403;;info@hanspeople.com;https://hanspeople.com/;Care & Healthcare, General Recruitment
Dublin;Harborlink Ltd;Harborlink Global Talent Solutions Cert;Suite 201 Q House 76 Furze Road Sandyford Dublin 18;EA5282;;;;General Recruitment, IT & Data Science, Sales & Marketing
Dublin;Harris and Porter Recruitment Limited;HAP Solutions Group;Block 1 Ground Floor Millbank Business Park Lucan Co. Dublin K78 WP59;EA5019;;;;Hospitality
Dublin;Harvey Nash (Ireland) Limited;;Ella House 39-43 Merriona Square Dublin 2 D02NP96;EA1341;35316741400;;https://www.harveynash.ie/;IT & Data Science, Board Level
Dublin;Hays Specialist Recruitment (Ireland) Limited;Hays Specialist Recruitment;26/27a Grafton Street Dublin 2 D02 HH24;EA1273;35315710010;;https://www.hays.ie;Admin & Office, Engineering, Accounting & Finance, Care & Healthcare
Dublin;Head Hunt International Limited;Head Hunt International;68 Harcourt Street Dublin 2 D02 C934;EA1033;35314188188;sylviah@headhunt.ie;https://headhuntinternational.com/;Care & Healthcare, IT & Data Science, Sales & Marketing, Admin & Office
Dublin;Headcount Solutions Limited;;4E Fingal Bay Business Park Balbriggan Co. Dublin K32 HN82;EA2274;35316905040;info@headcount.ie;https://www.headcount.ie;Engineering, Facilities, Pharma
Dublin;Health Sector Talent Limited;HEALTHDAQ;Unit A6 Bymac Centre Northwest Business Park Dublin 15 D15 YC61;EA3929;35318260692;contact@hst.health | dpo@healthdaq.com;https://healthdaq.com/;Care & Healthcare, IT & Data Science
Dublin;Hergreen Limited;M&C Ireland;19 Baggot Street Lower Co. Dublin D02X658;EA5110;353139269390;;https://www.hergreen.co.uk;Hospitality, Retail, Logistics & Warehousing
Dublin;Hibernia Projects Limited;;2 Alexandra Terrace Rockfort Avenue Dalkey Co. Dublin A96H1W0;EA5167;;;;Construction, Admin & Office, Cleaning Services
Dublin;Hibernia Services Ltd;Eir Evo Talent;2 Heuston South Quarter St John's Road West Dublin 8 D08Y42N;EA3717;35314396803;;;IT & Data Science
Dublin;Hikantoes Limited;;32D Rosemount Business Park Ballycolin Dublin 15 D15 WA06;EA5061;;;;Cleaning Services, Hospitality, General Recruitment
Dublin;Hireforce Ltd;;3 Hampton Park St Helen's Wood Booterstown Co. Dublin A94W593;EA4748;35312003124;info@hireforce.ie | robert.kennedy@hireforce.ie;https://hireforce.ie/;Construction, Cleaning Services, General Recruitment
Dublin;HKL Holding Ltd;1Medical;DOC Centre 12 Camden Court Dublin 8 D08R9CN;EA4597;35316834110;info@hklco.com;https://www.1medical.ie/;Care & Healthcare
Dublin;Honeycomb Jobs (Ireland) Ltd;Honeycomb Jobs;Fitzwilliam Hall, Fitzwilliam Place Dublin 2 D02T292;EA5243;35316994538;clare.p@honeycomb.jobs | hive@honeycomb.jobs | louise.q@honeycomb.jobs;https://www.honeycomb.jobs/;Admin & Office, HR, Legal
Dublin;Horizon Blue Talent Consulting Limited;Horizon Blue Talent Consulting;16 Broadfield Close Broadfield Manor Rathcoole Dublin 24 D24 KH59;EA4214;35319109928;;https://www.horizonbluetc.com/;Board Level, Care & Healthcare, Pharma, Accounting & Finance
Dublin;HQH Recruitment Ltd;;Unit 4, First Floor 84 Strand Street Skerries Co. Dublin K34 VW93;EA5158;;info@hqhrecruitment.ie;https://hqhrecruitment.ie;Retail, Admin & Office
Dublin;HR Hire Ltd;HR Hire;18 Domville Grove Killiney Co. Dublin;EA5379;353877454659;;https://hrsearch.ie/;Hospitality, Retail, Cleaning Services
Dublin;HRM Recruitment Ltd;HRM;47 Fitzwilliam Square, Dublin 2 D02 W967;EA1140;35316321800;info@hrmrecruit.com;https://hrmrecruit.com;Board Level, Care & Healthcare, HR, Supply Chain
Dublin;Hudson RPO Ireland Limited;Hudson RPO Ireland Limited;The Black Church St Mary's Place Dublin 7 D07P4AX;EA5316;35316765722;;https://www.hudsonrpo.com/;General Recruitment, Admin & Office
Dublin;Hunter Savage (Ireland) Ltd;;38-39 Fitzwilliam Square Dublin 2 D02 NX53;EA4227;35319069649;;https://www.huntersavage.com;Legal, Accounting & Finance, HR, Board Level
Dublin;Ibeabuchi Arua Kalu;Mployus Personnel Services;Apartment 14 7 Station Hill Clongriffin Dublin 13 D13C966;EA5179;353818900300;;;General Recruitment, Logistics & Warehousing, Cleaning Services
Dublin;IBM Ireland Limited;;IBM, We Work, Charlemount Exchange Block D Charlemont Street Dublin 2;EA4012;35318154000;;https://research.ibm.com/labs/ireland | https://www.ibm.com;IT & Data Science, Consultancy, Science
Dublin;ICDS Constructors Limited;ICDS Constructors (Ireland);24 Upper Fitzwilliam Street Dublin 2 D02N883;EA1912;35316321200;info@icds.ie;https://constructors.icds.ie/;Construction, Engineering, Management
Dublin;Icon Holdings Clinical Research International Limited;;South County Business Park Leopardstown Dublin 18 D18 X5R3;EA4933;;;;Care & Healthcare, Pharma
Dublin;IDM Ireland Dent Recruit Limited;Dent Recruit;59 Waterloo Lane Ballsbridge Dublin 4 D04X2K4;EA5182;;;https://www.dentrecruit.ie/;Dental Healthcare
Dublin;Impact Healthcare Services Limited;Impact Healthcare Services Limited;29 Castlefield Woods Clonsilla Dublin Dublin 15 D15F5P5;EA4888;+35316404683 | +353868707138;;https://www.impacthealthcare.ie;Care & Healthcare
Dublin;Indeed Ireland Operations Ltd;;Block B, Capital Dock 80 Sir John Rogerson's Quay Grand Canal Dock Dublin 2 D02 HE36;EA4017;;;;IT & Data Science, General Recruitment, Admin & Office
Dublin;Independent Clinical Services Ltd;Scottish Nursing Guild;3rd Floor 57 Adelaide Road Dublin 2 D02 Y3C6;EA4412;35319023080;;https://nursingguild.com/;Care & Healthcare
Dublin;Infcare Services Limited;Care Support Ireland;110 St James Wood South Circular Road Dublin 8 D08V029;EA5247;;;;Care & Healthcare
Dublin;Infoplus Technologies IE Limited;;The Black Church St Mary's Place Dublin 7 D07 P4AX;EA4440;;;;IT & Data Science
Dublin;Inform 3 (ROI) Limited;;The Blackchurch St Marys Place Dublin 7;EA4430;35315314886;michelle@inform3.com | office@inform3.com;https://inform3.com;Construction, Engineering, IT & Data Science
Dublin;Infotree Global Limited;;Alexandra House The Sweepstakes Ballsbridge Co. Dublin D04 C7H2;EA4766;;info@infotreeglobal.com;https://www.infotreeglobal.com/;Care & Healthcare, IT & Data Science, Engineering
Dublin;Infounity Systems Ltd;Infountiy Systems Ltd;17 Taylor Hill Wood Balbriggan Co. Dublin K32AX50;EA5310;;;;IT & Data Science, General Recruitment
Dublin;Innopharma Technology Ltd;Innopharma Technical Services;Raverscourt Business Park Three Rock Road Sandyford Dublin 18;EA5058;+35316950162 | +35316950163;admissions@innopharmalabs.com | info@innopharmatechnology.com;;Pharma, Engineering
Dublin;Innovative Employee Solutions Ireland Ltd;;Regus Block 1 Blanchardstown Corporate Park Ballycoolen Road Dublin 15 D15 AKK1;EA5095;;;;Employer of Record, HR, General Recruitment
Dublin;Insource People Company Limited;Insource Recruitment;Regus Pembroke House 28-32 Pembroke Street Upper Dublin 2 D02NT28;EA3972;353867777868;;http://www.insource.ie/;Admin & Office, IT & Data Science, Care & Healthcare
Dublin;Inspire Altra Ireland Limited;;5 Hollywoodrath Drive Hollystown Dublin 15 D15V8NN;EA4547;353892475818;;https://inspireireland.eu/;Care & Healthcare
Dublin;Institute of Chartered Accountants in Ireland;Chartered Accountants Ireland;Chartered Accountants House 47-49 Pearse Street Dublin 2;EA1181;35316377200;info@charteredaccountants.ie;https://www.charteredaccountants.ie;Accounting & Finance, General Recruitment
Dublin;Interval Consulting Ltd;;Office 2 12A Lower Main Street Lucan Co. Dublin K78 X5P8;EA5130;;;https://www.intervalgroup.com/;Admin & Office, HR
Dublin;Intuiwork;Intuiwork;49 - 50 Coleraine Street Co. Dublin D07XW62;EA5381;;;;Hospitality, Admin & Office
Dublin;Iona Forte Ltd;HRP Group;26 Upper Pembroke Street Dublin 20 D02 X361;EA3587;35316760006;info@hrpgroup.ie;https://hrpgroup.ie;Board Level, HR, Admin & Office
Dublin;IPSUS Technologies Ltd;;Regus House Harcourt Centre Harcourt Road Dublin 2 D02 HW77;EA2241;35314773401;;https://ipsus.com;IT & Data Science
Dublin;Ireland Training and Translations T&T Limited;Ireland T& T Ltd;Unit 11C Parkmore Industrial Estate Long Mile Road Dublin 12 D12RH39;EA5369;35314604829;info@irelandtt.com;https://irelandtt.com;Interpreting, Admin & Office
Dublin;Irewil Care Limited;;Block 1, Blanchardstown Corporate Park Ballycoolen Road Co. Dublin D15AKK1;EA5299;+35312645066 | +353834800169;;https://www.irewilcare.ie/;Care & Healthcare
Dublin;Iris Nursing Limited;;53 Kylemore Avenue Ballyfermot Dublin 10 D10Y628;EA4974;353851853541;info@irisnursing.com;https://irisnursing.com;Care & Healthcare
Dublin;Iris Thaumas Ltd;;20 Harcourt Street Dublin 2 D02 H364;EA5256;;;;General Recruitment, HR, Accounting & Finance, IT & Data Science
Dublin;Irish Dental Jobs Ltd;Irish Dental Jobs;52 Delvin Banks Naul Co. Dublin K32 F670;EA3754;35318494070;info@irishdentaljobs.ie;https://irishdentaljobs.ie;Dental Healthcare, Admin & Office
Dublin;Irish Recruitment Consultants Limited;;c/o Ogier Global (Ireland) Ltd Investment House 8-34 Percy Place Dublin 4 D04 P5K3;EA1048;35316610644;;https://jobs.guidantglobal.com/clients/irc;Accounting & Finance, Admin & Office, General Recruitment, IT & Data Science
Dublin;Irish School of Motoring Ltd;ISM Recruitment;Jamestown Business Centre Finglas Dublin 11 D11X853;EA3659;35318912330;info@ism.ie | recruitment@ism.ie;https://www.ism.ie;Driving, Logistics & Warehousing, Admin & Office
Dublin;Isource Recruitment Limited;;The Terenure Enterprise Centre 17 Rathfarnham Road Terenure DDW YW11 Dublin 6W;EA4144;;;https://isourcerecruitment.ie/;Care & Healthcare, General Recruitment, Admin & Office
Dublin;ITM Healthcare Ltd;ITM Staffing limited;3 Dublin Landings North Wall Quay Dublin 1;EA5097;35315788087;;https://www.itmstaffing.co.uk/;Care & Healthcare
Dublin;I.T. Alliance Group Limited;I.T Alliance Resourcing Services;12c Joyce Way Park West Business Park Dublin 12;EA3640;35318690200;;https://www.itallianceresourcingservices.com/;IT & Data Science, Industrial, General Recruitment
Dublin;James Ajimo Owala;CJ Care Solutions;69 New Haven Bay Balbriggan K23 CX46 Co. Dublin;EA4015;;info@cjcaresolutions.ie;https://cjcaresolutions.ie/;Care & Healthcare
Dublin;Janette Purcell Consulting Ltd;Talentcru;34 Bayview Close Killiney Co. Dublin;EA4935;;;;IT & Data Science, HR, General Recruitment
Dublin;Jimson Kaiparampattu James;Kate Hamilton International Healthcare;C4 Swords Enterprise Park Feltrim Road Swords Co. Dublin KC7HC44;EA4375;35314370322;;https://katehamilton.ie/;Care & Healthcare
Dublin;JJK Personnel Ireland Ltd;Falcon Green;Office 128 Digital Office Center Balyheary Road Swords Co. Dublin K67 E5A0;EA4448;35314470409;;https://www.falcongreen.com/;Construction, Engineering, General Recruitment
Dublin;Joamerican Consultancy Ltd;;Swords Enterprise Park C4, Feltrim Rod Swords Co. Dublin;EA4750;353874057098;info@joconsultancy.ie;https://joconsultancy.ie/;General Recruitment, Cleaning Services, Care & Healthcare
Dublin;Job Catch Recruitment Limited;Job Catch Recruitment;Unit 118 Baldoyle Industrial Estate Grange Hill Dublin 13;EA4953;;;;Industrial, Logistics & Warehousing, Admin & Office
Dublin;Jubina Ltd;Jubina Recruitment Agency;Seven Oak 4 Apt Oakhouse Sarsfield Road Dublin 10 D10FX26;EA4753;35319682445;info@jubina.com;https://jubina.com;Care & Healthcare, Hospitality
Dublin;Judmar Consulting Ltd;;83 Monkstown Road Monkstown Dublin Co. Dublin A94A5Y9;EA4899;;info@judmar.ie;https://judmar.ie;Admin & Office, Care & Healthcare
Dublin;Kaizen Workforce Solutions Limited;;85/86 Grafton Street Dublin 2;EA3054;35316729000;info@kaizenworkforcesolutions.com | tracy@kaizenworkforcesolutions.com;https://kaizenworkforcesolutions.com;Logistics & Warehousing, Retail, Factory
Dublin;Kamiq Recruitment Limited;;13 Keane Hall Collegewood Castleknock Dublin 15 D15K3VK;EA4779;;sorin@kamiqrecruitment.com;https://kamiqrecruitment.com/;Care & Healthcare
Dublin;Karenbridge Associates Ltd;The Panel;21 Northumberland Road Ballsbridge Dublin 4 D04 H2Y4;EA1066;35316377000;;https://thepanel.com/;Accounting & Finance, Legal, HR, Accounting & Finance
Dublin;Katakey Consulting;;77 Camden Street Lower Dublin Co. Dublin D02 XE80;EA5280;353858045855;kpoberezhets@katakeyconsulting.com;https://katakeyconsulting.com;Admin & Office, Care & Healthcare
Dublin;Kate Cowhig International Healthcare Limited;;Ground Floor One Haddington Buildings Haddington Road Dublin 4;EA1124;35316715557;;https://kcr.ie/;Care & Healthcare
Dublin;Kearney Placement Consultants Limited;GKR Search & Selection;26/27 Upper Pembroke Street Dublin 2 D02 X361;EA1834;35316769008;;https://www.gkr.ie/;PR, Accounting & Finance, Admin & Office, Legal, Sales & Marketing
Dublin;Kedal Resources Ltd;Kedal Resources Limited;Unit 9, Block C Cashel Business Centre Cashel Road Dublin 12 D12 X720;EA4258;353876815787;;https://kedalresources.com/;Logistics & Warehousing, Cleaning Services, Security
Dublin;Kevin Cleary;Macintosh Recruitment;Unit 3 Malahide Marina Malahide Co. Dublin K36 W540;EA5100;353860626240;info@macintoshrecruitment.com;https://macintoshrecruitment.com/;Hospitality
Dublin;Kobe Goodboy Limited;Holmes Talent;8 Eden Park Mews Glastule Co. Dublin A96HF10;EA5273;;stephen@holmestalent.com;https://www.holmestalent.com/;Sales & Marketing, IT & Data Science, HR
Dublin;Korn Ferry (IE) Limited;;Newmount House 22-24 Lower Mount Street Dublin 2 D02 Y759;EA4350;35312344300;dan.gugler@kornferry.com | david.phelan@kornferry.com;https://kornferry.com;Board Level, HR, General Recruitment
Dublin;KPMG Ireland;KPMG Ireland;1 Stokes Place St Stephens Green Co. Dublin;EA5314;;;;Accounting & Finance, Audit, Legal, Consultancy
Dublin;KWW Recruitment Ltd;FS Recruitment;16 Glenvara Park Knocklyon Dublin 16 D16YH66;EA4649;353877964804;info@fsrecruitment.ie;https://www.fsrecruitment.ie/;Accounting & Finance, Insurance, Admin & Office
Dublin;K&K Swift Recruitment Ltd;;Ground Floor 71 Lower Baggot Street Dublin 2 D02P593;EA4757;353870619830;info@kkrecruitment.ie;https://kkrecruitment.ie/;General Recruitment, Industrial, Cleaning Services
Dublin;K.E.D.S Consultants Ltd;Drinks2U;New Work Junction 11 Wynnefield Road Rathmines Dublin 6 D06 F9C1;EA4321;;;https://www.drinks2u.ie/;Logistics & Warehousing, Driving
Dublin;Lancesoft Limited;;Harcourt Centre Harcourt Road Dublin 2 D02HW77;EA5144;;;https://lancesoft.in/;IT & Data Science, Care & Healthcare, Engineering
Dublin;Lansdowne Executive Search Limited;Lansdowne Executive Search;Hamilton House 28 Fitzwilliam Place Dublin 2 D02 P283;EA3858;+35315490066 | +353877961062;enquiries@lansdownesearch.ie;https://lansdownesearch.ie;Board Level, Consultancy
Dublin;Lastel Limited;Lastel Recruitment;18 Fairway Hall Abbot Drive Cualanor Dun Laoghaire, Co. Dublin A96 X31C;EA4346;353834799356;info@lastel.ie;https://lastel.ie/;Care & Healthcare, General Recruitment
Dublin;LB 360 Search Limited;360 Search;The Garrison 31-32 Leeson Street Lower Dublin 2 D02 KA62;EA3523;35316344990;info@360search.ie;https://360search.ie;Insurance, Accounting & Finance
Dublin;Learghusa Limited;Learghusa Employment International;213 Swords Road Whitehall Dublin 9 Co. Dublin D09 VF70;EA4433;35318101610;admin@learghusa.com;http://learghusa.com/index.html;Hospitality, Care & Healthcare, Retail
Dublin;Lee Hecht Harrison Ireland Limited;LHH Recruitment Solutions;Suite 204 10 Ely Place Co. Dublin D02HR98;EA5352;35316731540;;https://www.lhh.com/uk/en/;Board Level, Career, HR, Consultancy
Dublin;Lex Consultancy Limited;;15-17 South Leinster Street Dublin 2 D02 CY95;EA3252;35316628990;info@lexconsultancy.ie;https://lexconsultancy.ie;Legal, Admin & Office, Public Sector, Accounting & Finance
Dublin;Liberty Networks Ltd;Brightmove;Carlisle Building 51 Bracken Road Sandyford Business Park Co. Dublin D18 CV48;EA4964;35319026608;;https://brightmove.ie/;IT & Data Science, Admin & Office
Dublin;Linart Career Solutions Limited;;602 Cube 1 Beacon South Quarter Sandyford Dublin 18 D18DD50;EA5162;;;;Care & Healthcare, Cleaning Services, Admin & Office
Dublin;Lincoln Healthcare & Training Ltd;Medforce;5 Fitzwilliam Square East Dublin 2;EA5029;35319637070;info@medforce.ie;https://medforce.ie/;Care & Healthcare
Dublin;Lincoln Search & Selection Limited;Lincoln Recruitment Specialists;5 Fitzswilliam Square Dublin 2 D02R744;EA3366;35316610444;info@lincoln.ie;https://lincoln.ie/;Accounting & Finance, Legal, Sales & Marketing
Dublin;Local Jobs Limited;Celtic Careers;Unit G, Ground Floor Offices Citywest Shopping Centre Tallaght Dublin 24 D24 FA07;EA3470;35316278750;info@celticcareers.com;https://www.celticcareers.ie/;Admin & Office, HR
Dublin;Locstok Construction Limited;;Apt 11 Blackrock House 28 Newtown Ave Blackrock Co. Dublin A94RF70;EA4938;;;;Construction, General Recruitment
Dublin;Locumlink Associates Limited;;32 Ranelagh Road Ranelagh Dublin 6;EA2362;35314956666;info@locumlink.ie;https://locumlink.ie;Care & Healthcare
Dublin;Locumotion Limited;;Floor 7 RSA House Dundrum Town Centre Sandyford Road Dundrum Dublin 16 D16 FC92;EA1611;35312993550;info@locumotion.com;https://www.locumotion.com;Care & Healthcare
Dublin;Logiskills Limited;The Logiskills Group;Suite 4 Baldoyle House 111 Grange Way Baldoyle Dublin 13;EA2181;35318326330;info@logiskills.ie;https://logiskills.ie;Supply Chain, Logistics & Warehousing, Factory, Engineering
Dublin;Lourmel Limited;Xtra Nursing Agency;19A Montague Street Dublin 2 DO2 TRT2;EA4153;35315685178;;https://www.xtranursingagency.ie/;Care & Healthcare
Dublin;Magnit Global UK Limited;Magnit Global UK Limited;Paramount Court Carrig Road Sandyford Business Park Dublin 18 D18 R9C7;EA3744;;;;General Recruitment, IT & Data Science, 
Dublin;Magnit Global UK WFQLimited;Magnit Global UK WFQ Limited;Paramount Court Corrig Road Sandyford Business Park Dublin 18 D18R9C7;EA4034;;;;
Dublin;Management Support Services (Ireland) Limited;MSS Recruitment;The Courtyard Hill Street Dublin 1;EA1044;35318870690;recruitment@mssthehrpeople.ie;https://www.mssthehrpeople.ie;Cleaning Services, Facilities, Admin & Office
Dublin;Manpower Group (Ireland) Limited;Manpower Group Ireland;The Masonry 151 Thomas Street Co. Dublin D08PY5E;EA1001;35316455200;info@manpower.ie;https://www.manpower.ie/;Admin & Office, IT & Data Science, Accounting & Finance, Industrial
Dublin;Mapas Recruitment;;91 Avondale Road Killiney Co. Dublin;EA5397;;;;Hospitality, Care & Healthcare, Admin & Office
Dublin;Marketing Career Recruitment Ltd;Marketing Career Recruitment;21 Northumberland Road Dublin 4 D04 H2Y4;EA3457;;;;Sales & Marketing, Admin & Office
Dublin;Marketing People Limited;The People Group;4 Clanwilliam Square Dublin 2;EA1682;35316619636;admin@peoplegroup.ie;https://PeopleGroup.ie;Sales & Marketing, IT & Data Science, Retail
