County;Agency_Name;Trading_Name;Address;Licence_Number;Phone;Email;Website;Covered_Fields
Kerry;CSE Connect Limited;;Valentia Road Medical Centre Caherciveen Co. Kerry V23 TF44;EA5153;353862006960;info@cseconnect.ie;https://bit.ly/44dnmYQ | https://cseconnect.ie | https://www.mytown.ie/b/CSE-Connect-Limited;General Recruitment, Business Services
Kerry;Dromerin Road Healthcare Limited;Dromerin Road Recruitment;Dromerin Listowel Co. Kerry V31 A365;EA5382;353876061131;donnacha@dromerinroad.com | louise.callanan@hse.ie;https://Healthcarejobs.ie | https://dromerinroad.com | https://kerrycollins.co.uk/ | https://www.rezoomo.com/job/77093/?Medical%20Officer%2C%20Residential%20and%20Rehabilitation%20Services%20for%20Older%20People%20-%20County%20Kerry;Care & Healthcare
Kerry;Fohntech Ireland Ltd;;Unit H4 Clash Industrial Estate Tralee Co. Kerry;EA4438;+353664018710 | +353870683543;info@fohntechgroup.com;https://fohntechgroup.com | https://www.fohntech.com/ | https://www.fohntechtrafficmanagement.ie/;Engineering, Technical Services, Infrastructure
Kerry;Kerry Senior Care Ltd;Home Instead Senior Care;Grosvenor Court High Street Killarney Co. Kerry;EA4193;353667182000;emeakerrycentre@kerry.com | kerry@homeinstead.ie;https://caringfranchise.com/media-center/caring-senior-service-partners-with-kerry-care/ | https://kerry.care/ | https://retirementservices.ie/home-care-kerry/ | https://www.seniorcare.ie/listings/killarney-nursing-home/;Care & Healthcare
Kerry;Red Chair Recruitment Limited;;3rd Floor 91 New Street Killarney Co. Kerry;EA3856;353646622007;grace@redchair.ie | paudie@redchair.ie;https://discoverkerry.com | https://redchairrecruitment.ie;IT & Data Science, Accounting & Finance, Hospitality, Care & Healthcare, Construction, Engineering, Sales & Marketing, Admin & Office, Board Level
Kerry;The HR Specialists Limited;Tempest;No. 1 Ballycasheen Gardens Upper Park Road Killarney Co. Kerry V93F2Y5;EA4348;353877388306;kerry@thehrspecialists.co.uk | tillyclarke@peoplelaw.legal;https://hrlifegroup.com/ | https://thehrspecialists.net | https://www.thehrspecialists.co.uk/;HR
Kerry;Verena Limited;HQ Tralee;Block 2 Dominick St Tralee Co. Kerry V92 C799;EA5140;;info@verenagroup.com;https://www.verena.website/ | https://www.verenagroup.com/;Compliance, Business Services
Kerry;XML Germany (IE) Ltd;;3 Bridge Lane Tralee Co. Kerry V92 PT98;EA4772;35345931000;accounts.payable@kerry.ie | emeakerrycentre@kerry.com | eur.gbsap_comms@kerry.com;https://kerry.com;International Staffing
Kerry;XML International Consultants (Ireland) Limited;;3 Bridge Lane Tralee Co. Kerry V92 PT98;EA4416;353667182000;;https://xmlinternational.com/about-us/;Consultancy
Kerry;XML (Austria) IE Limited;;3 Bridge Lane Tralee Co. Kerry V92 PT98;EA4610;35345931000;emeakerrycentre@kerry.com;https://firmen.wko.at/xml-austria-ie-limited/wien/?firmaid=17ed8399-c8c4-428e-ab20-60581a150d74 | https://kerry.com | https://xmlinternational.com/about-us/;International Staffing
Kerry;XML (ITALY) IE LTD;;3 Bridge Lane Tralee Co. Kerry V92 PT98;EA4822;353667182000;emeakerrycentre@kerry.com | eur.gbsap_comms@kerry.com | kerry.southafrica@kerry.ie;https://atoka.io/public/en/company/xml-italy-ie-limited/57568f23cae5 | https://www.kerry.com/about/global-locations | https://www.reportaziende.it/xml_italy_ie_limited_16928041009;International Staffing, General Recruitment
Kildare;A-Prompt Recruitment Limited;A-Prompt Recruitment & Trading;22 Henry Street Newbridge Co. Kildare;EA2097;+353834238885 | +353892527224;info@aprompt-.com | info@apromptrecruitment.com | john.morris@aprompt-recruitment.com | robert.wang@aprompt-recruitment.com;https://aprompt-recruitment.com | https://www.farmersmarket.ie/adverts/on-farm-jobs/11d439ed-a-prompt-recruitment-limited;Agriculture, General Recruitment
Kildare;Adrian Macholl;Macholl Recruitment;1st Floor 32 North Main Street Naas Co. Kildare;EA4656;;rutherford@empirerecruitment.ie;https://empirerecruitment.ie | https://machollrecruitment.ie/ | https://www.itftennis.com/en/players/adrian-macholl/800774633/irl/vt/S/overview/;Logistics & Warehousing
Kildare;Approzeal Limited;;Business Suite 1 47 Millbridge Way Mill Lane Naas Co. Kildare W91 RHW9;EA4839;+35345579145 | +353873516450;david.kennedy@glenveagh.ie | info@approzeal.com | info@clonmelent.com | smithgroundworks@gmail.com;https://approzeal.com | https://www.signalhire.com/companies/approzeal-recruitment;Care & Healthcare
Kildare;Armont Recruitment Limited;;Unit A3 M4 Business park Celbridge Co. Kildare;EA3981;+35315563399 | +353879454827;hello@armont.ie | jane@jpconnections.co.uk;https://armont.ie/ | https://www.erfireland.com/agency-list/ | https://www.getirishjobs.com/jobs/view/company-accountant-1;Accounting & Finance, Real Estate, Energy Sector
Kildare;Auxilia Limited;Auxilia Limited;Unit 4a, Elm House Millennium Park Naas Co. Kildare W91 XW52;EA4293;35345850668;info@auxiliagroup.ie | support@validtheme.com;https://auxiliagroup.ie | https://www.auxiliagroup.com/en/company/ | https://www.countykildarelp.ie/wp-content/uploads/2024/05/AuxiliaGroup-Brochure-2024.pdf;General Recruitment, Business Services
Kildare;Broadwork Ltd;Sonas Technical;Unit M4 Naas Town Centre Dublin Road, Naas Co. Kildare W91F7X3;EA3996;;;;Technical, Engineering
Kildare;Career Vision Recruiters Limited;Career Vision Recruiters Ltd;Unit W9I 1st Floor Newhall, Ladytown Business Pk Naas Co. Kildare W91 E822;EA4426;35314438906;brid@cvrecruiters.ie | info@cvrecruiters.ie;https://careervisionrecruiters.ie/ | https://cvrecruiters.ie | https://www.careervision.ie/;Hospitality, Dental Healthcare
Kildare;Catering Crew Hospitality Limited;;Unit 3 Link Business Park Killcullen Co. Kildare;EA4949;35345940360;events@hospitalityrecruitment.ie | hospitality@cateringcrew.ie | recruitment@cateringcrew.ie;https://aibf.ie/times/profile/catering-crew-hospitality/ | https://cateringcrew.ie | https://hospitalityrecruitment.ie | https://www.cateringcrewgroup.com/en/team/;Hospitality, Catering
Kildare;Clark Executive Limited;Clark Recruitment Ltd;The Atrium John's Lane Naas Co. Kildare W91YA2W;EA2102;35345881888;hello@clark.ie;https://clark.ie/ | https://www.countykildarechamber.ie/clark/;Board Level
Kildare;Clark Recruitment Limited;Clark Recruitment;The Atrium John's Lane Naas Co. Kildare W91 YA2W;EA1407;35314784668;ali@clark.ie | niamh@clark.ie;https://clark.ie/ | https://www.countykildarechamber.ie/clark/;Accounting & Finance, Sales & Marketing, Admin & Office, HR, Board Level
Kildare;Confluence Talent Limited;;51 Stationhouse The Waterways Sallins Co. Kildare W91 YV59;EA4857;;;https://recruiterflow.com/cmc/jobs | https://www.confluencegroup.co.uk/;Construction, Technical Roles
Kildare;Denise Brady Recruitment Limited;Teamworx Recruitment;14 Liffey Lawns Clane Co. Kildare;EA2115;35315240584;info@teamworx.ie;https://Employee.ie | https://www.teamworx.ie;General Recruitment, Career Development
Kildare;Duniacare;;32 Oaktree Road Cunnaberry Hill Co. Kildare R51YX76;EA5270;;cho7.lpf@hse.ie | info@duniacare.com | naas.nhss@hse.ie;https://aeroleads.com/list/top-health-care-companies-in-kildare | https://duniacare.com | https://upmc.ie/locations/hospitals/kildare/about | https://www.dynacare.ca/ | https://www.kmcgp.ie/;Care & Healthcare
Kildare;Enterprise People Limited;Enterprise People Limited;32 The Hawthorns Kilcock Co. Kildare W23 E068;EA2050;+35316287797 | +35316287800 | +35316287801;info@enterprisepeople.ie | patrick@enterprisepeople.ie;https://www.enterprisepeople.ie;General Recruitment
Kildare;Eoin Gorman Contracts Ltd;GCL Group;Unit 3 Crookstown Business Park Ballitore Co. Kildare R14ND91;EA4287;353872434803;egorman@dagdacontracts.ie | eoin@gclgroup.ie | tjordan@dagdacontracts.ie;https://dagdacontracts.ie | https://www.gclgroup.ie/about-us/;Construction, Engineering, Project Management
Kildare;Excel Technical Consulting Ireland Ltd;;318 Morrell Avenue Naas Co. Kildare W91 W8HT;EA4579;;ciara@excelrecruitment.com;https://Hotline.ie | https://aviation.report/companies/excel-technical-consulting | https://etc.aero/ | https://excelrecruitment.com | https://www.fcscorporateservices.com/;Aviation, Technical, Engineering
Kildare;Final Draft Mapping Ltd;Final Draft Mapping Ltd;5 The Avenue Coach Road Meadows Clane Co. Kildare W91FXP5;EA5218;+353833570990 | +353834030822;info@finaldraftmapping.com;https://coaching.finaldraftmapping.com/contact/ | https://finaldraftmapping.com | https://jobs.finaldraftmapping.com/;Surveying, Mapping, Consultancy, GIS Services
Kildare;Fresh Start Recruitment Limited;International Staffing Solutions;Office Unit L Naas Town Centre Naas Co. Kildare;EA1898;35345901694;ffs@freshstart.ie | info@freshstart.ie | john.smith@fsr.uk.com | john@fsr.uk.com | johnsmith@fsr.uk.com;https://freshstart.ie | https://www.rte.ie/news/2017/0712/889704-hiqa/ | https://www.yellowpages.net/recruiter/IE-County-Kildare/Naas/Fresh-Start-Recruitment-IE61174.html;International Staffing, General Recruitment, Temporary Staffing
Kildare;Ginnety Recruitment Ltd;Ginnety Recruitment Consultancy;140 Oldtown Woods Celbridge Co. Kildare W23 Y13W;EA5071;;andrew@ginnetyrec.com;https://careerandyg.com/ | https://countykildarelp.ie | https://ginnetyrec.com;General Recruitment, Career Development
Kildare;Global Talent Bridge;;5 The Burrows Coneyboro Athy Co. Kildare;EA5363;;info@globaltalentpartners.net | info@wandel.com;https://communitycolleges.globaltalentbridge.org/ | https://ghirebridge.com/ | https://goldbridgeglobaltalent.com/ | https://talentbridgeglobal.com | https://www.talent-bridge.co.uk/ | https://www.wes.org/wes-global-talent-bridge-evolves/;International Staffing, General Recruitment
Kildare;Help Me Recruit Ltd;;6 Oldtown Villas Naas Co. Kildare W91 Y7HR;EA4468;;info@countykildarelp.ie | susankeogh@outlook.ie;https://outlook.ie;General Recruitment
Kildare;Honest Consultancy Limited;Honest Consultancy Limited;Unit F13 Maynooth Business Campus Straffan Road, Maynooth Co. Kildare W23Y5N7;EA5298;;;https://honestrecruitment.ie/ | https://www.honestconsultancy.co.uk/;Consultancy, General Recruitment
Kildare;Infinite Opportunity Staffing;IOS;Fairgreen St Naas West Naas Co. Kildare W91E718;EA5289;;;https://hartleypeople.com/recruitment-agency-kildare/ | https://infinitas-group.com/ | https://infinite-staff.com/domains/ | https://kildarelaes.ie/;Temporary Staffing, General Recruitment
Kildare;IRLD Recruitment Solutions Ltd;IRLD Hire Solutions;The Hub Market Square Ballymore Eustace Co. Kildare W12XER2;EA5048;+353874577732 | +353874700664;info@irld.ie;https://www.irldhiresolutions.ie/;General Recruitment
Kildare;Kildare Playcentre LTD;EPCM Recruitment;Kildare Playcentre Ltd Johnstown Nass Co. Kildare W91KD28;EA5202;;;https://air-tastic.com/locations/kildare | https://daysout.ie/celbridge-playzone-kildare/ | https://www.celbridgeplayzone.ie/ | https://www.fun.ie/fun-factory-kildare;Care & Healthcare
Kildare;Learghusa Healthcare Agency Limited;;34 Duke St Athy Co. Kildare R14 KR67;EA4784;+35318101610 | +353871319401;admin@learghusa.com | clones@monaghancoco.ie | healthcare@learghusa.com | immigration@learghusa.com;https://learghusa.com;Care & Healthcare
Kildare;Leinster Appointments Limited;Leinster Appointments;Level 1 Town Centre House Naas Town Centre Co. Kildare W91 P7XA;EA3318;+35345988500 | +353858016576 | +353858749410 | +353858749551 | +353858749552 | +353872363452 | +353876685928;info@leinsterappointments.ie | john@leinsterappointments.ie;https://courtyardshoppingcentre.ie/home/store_info?id=104 | https://leinsterappointments.ie | https://www.naastowncentre.ie/home/store_info?id=104 | https://www.yoys.ie/phone-353-45988500-employment-agency-Naas-IE14840.html;Accounting & Finance, HR, Admin & Office, Audit, Tax
Kildare;Lotus International;;21 Castlevillage Crescent Celbridge Co. Kildare W23EW42;EA5400;35312204616;contact@lotusintex.com | contactus@worldwide.lotuscars.com | customerservice@lotus-intl.com | md@lotusintex.com | vp@lotusintex.com;https://licus.com/ | https://linktr.ee/lotuskildare | https://lotus-intl.com/ | https://lotuskildare.com/ | https://oaklane.ie | https://www.fresha.com/lvp/lotus-kildare-kildare-zn28e2;General Recruitment
Kildare;Loyola Global Careers Limited;Loyola Global Careers;Apartment 3, The Courtyard Straffan Road, Maynooth, Co. Kildare W23RC64;EA3904;+35319609193 | +353894400778;info@loyolaglobalcareers.ie | jxxxxxxs@loyolaglobalcareers.ie | xx@loyolaglobalcareers.ie;https://www.loyolaglobalcareers.in | https://loyolaglobalcareers.ie | https://www.loyolaglobalcareers.com/contact.html | https://www.signalhire.com/companies/loyola-global-careers;Care & Healthcare
Kildare;Madereso Ltd;DRS;6 Rinawade Close Leixlip Co. Kildare W23RP49;EA5118;+353598638099 | +353874333394 | +353874452493;aquinn@kildarecoco.ie | dcallanan@kildarecoco.ie | economicunit@kildarecoco.ie | info@countykildarechamber.ie | johnmcdermott@kildarecoco.ie | pdonohoe@kildarecoco.ie;https://cascadedesigns.com/pages/thermarest-our-history-ireland | https://entexol.com/contact-us/ | https://kildarecoco.ie | https://maresos.com/ | https://whoward.eu/about/ | https://www.localenterprise.ie/Kildare/About-Us/Our-Team/;Life Sciences, Semiconductor, Data Centre, Construction
Kildare;Nellys Private Homecare Services Ltd;;5 Springfield Drive Clane Road Celbridge Co. Kildare W23DH79;EA5357;353892698668;info@nellyshomecare.ie;https://nellyshomecare.ie;Care & Healthcare
Kildare;O'Reilly Curran & Associates Ltd;O Reilly Consulting;Unit W10F Ladytown Business Park Newhall, Naas Co. Kildare W91 DF80;EA4096;;frank@mcmahonandco.ie | info@orbs.ie | linda@edst.ie | nicholas@nicholascushnahan.ie | sue@edst.ie;https://firmania.online/naas/oreilly-curran-associates-limited-87950 | https://www.hrconsultants.ie;HR, General Recruitment
Kildare;Pro-Active Search & Selection Limited;;5 Bridgefield Manor Ardreigh Athy Co. Kildare R14 KX32;EA1908;;;http://www.pass.ie/about.html | http://www.salespider.com/country/ie/bw-8797502/proactive-search-and-selection-limited | https://proactiveselection.com/search-selection/;General Recruitment, Board Level
Kildare;SMJ Ideal Solutions Limited;Ideal Solutions Ireland;33 Gallowhill Court Athy Co. Kildare R14F573;EA4754;;;https://idealsolutions.com/en | https://www.idealsolutionsireland.ie/contacts.html | https://www.smj.ltd/About;General Recruitment
Kildare;Sparktel Recruitment Ltd;;55 South Main St Naas Co. Kildare W91 HX90;EA3895;35315563330;info@countykildarelp.ie | jobs@sparktel.ie;https://sparktel.ie;IT & Data Science, Utilities, Engineering, Mechanical, Electrical, Skilled Trades
Kildare;Strategic Placement Dublin Ltd;Airport Staff/Driving Force/Total Talent Solutions;Friary Business Park Naas Co. Kildare;EA4558;;info@strategicplacements.com;https://splacement.com/ | https://strategicplacement.ie/ | https://strategicplacements.com;General Recruitment, Airport Staff, Logistics & Warehousing
Kildare;Tender Touch Services Limited;Tender Healthcare Services;Suite 15, Charlotte House Charlotte Street Newbridge Co. Kildare;EA4875;353894333208;info@tendertouchservices.ie | tendertouchcare101@gmail.com;https://tendertouchservices.co.uk/ | https://tendertouchservices.ie;Care & Healthcare
Kildare;The Caterwaiter Supply Company Ltd;;Unit H11 Maynooth Business Campus Maynooth Co. Kildare W23 R9V4;EA3706;+35316290534 | +353868237179;bookings@caterclean.ie | healthcare@heydaygroup.ie | hospitality@heydaygroup.ie;https://Employee.ie | https://caterwaiter.ie | https://heydaygroup.ie | https://heydayrecruitment.ie/about-us/ | https://nrf.ie/author/nrf2004/;Hospitality, Catering, Care & Healthcare
Kildare;Verax Limited;;Suite 1, Jassmine Housee Main Street Celbridge Co. Kildare W23 F5D9;EA4704;+35316544708 | +35318293099;info@verax-semiconductor.com;https://silicon-saxony.de/en/mitglieder/verax-limited-jasmine-house-2/ | https://verax-semiconductor.com | https://verax.co.uk/;Semiconductor Engineering, Technical Recruitment
Kildare;Xtech Fab Ready Solutions Europe Limited;MSR-FSR;Block B Maynooth Business Campus Maynooth Co. Kildare W23W5X7;EA4149;;;https://www.pappers.fr/entreprise/xtech-fab-ready-solutions-europe-ltd-840143978;Technical Solutions & Engineering
Kilkenny;Agri General Staff Solutions Limited;;Galmoy Via Thurles Co. Kilkenny;EA5370;353857569456;sales@agrigenstaffsolns.com;https://agrigenstaffsolns.com | https://agrigenstaffsolns.ie/;Agriculture
Kilkenny;Ballywater;;43 Michael St Kilkenny Co. Kilkenny;EA5259;353851234273;hello@ballywater.ie | iandevoy@ballywater.ie;https://Zuko.ie | https://ballywater.ie | https://www.townlands.ie/kilkenny/callan/callan/callan-rural/ballywalter/;General Recruitment, Logistics & Warehousing, Supply Chain
Kilkenny;Motherway Consulting Limited;Motherway Consulting Limited;Talamh Ur Smithstown, Tullogher Co. Kilkenny X91 DY29;EA3982;;carmelmotherway@gmail.com;https://motherwayconsulting.ie | https://brokersireland.ie/webinars/non-executive-board-members-mortgage-intermediaries-ethics/;General Recruitment, Consultancy
Kilkenny;Orx Recruitment and Consulting Limited;;Kilree Kells Co. Kilkenny;EA4763;;;;General Recruitment, Consultancy
Kilkenny;Prochem Engineering Limited;;14 Danville Business Park Co. Kilkenny R95 F727;EA3372;+353212066178 | +353567790100 | +353567790101 | +353872622239 | +353872648000;donal_higgins@prochem.ie | info@prochem.ie;https://prochem.ie | https://www.investkilkenny.ie/our-companies/engineering/ | https://www.kilkennychamber.ie/directory-members/listing/prochem-engineering/;Engineering
Laois;Angela Fitzpatrick Shortt;Recruitment Consultants;6 Grenville Portlaoise Co. Laois R32F2KP;EA2185;;angela@shorttrecruitment.ie | info@shorttrecruitment.ie;https://jobsirish.ie/employer/shortt-recruitment/ | https://midlandjobs.ie/company/1744/shortt-recruitment/ | https://shorttrecruitment.ie | https://www.laoistoday.ie/2023/02/21/in-pictures-2023-laois-jobs-fair-proves-another-great-success-with-big-attendance/;General Recruitment
Laois;DCS Services;;Unit 2, Site 2 Clonminam Business Park Portlaoise Co. Laois;EA5297;;corpaffairs@laoiscoco.ie;https://dcsserviceinc.com/ | https://www.dcsservices.ie/ | https://dcsstl.com/ | https://laois.ie/governance-and-administration/customer-support/customer-service-request | https://laoiscoco.ie | https://mcgclp.ca/dcs-services-lp/ | https://www.citizensinformation.ie | https://www.dcs.mu/about/;Construction, Engineering, IT & Data Science, Supply Chain
Laois;Dereach Recruitment Agency Ltd;Dereach Care;51 Clonroosk Abbey Portlaoise Co. Laois R32 HH36;EA4934;;info@dereachrecruitment.ie;https://dereachrecruitment.ie | https://isocerts.com/about-us-2/;Care & Healthcare
Laois;Newpath Healthcare Ltd;;30 Landsdowne Road Portarlington Co. Laois;EA5395;;;https://newpath.ca/ | https://newpath.healthcare/ | https://newpathhealthcare.com/contact-us | https://www.newpath.com/contact-us;Care & Healthcare
Laois;Nuvo Recruitment Limited;;Unit G4 Parkside Portlaoise Co. Laois;EA3528;353852151970;eimear.allen@nuvo.ie | info@nuvo.ie;https://laoischamber.ie | https://laoisjobsfair.ie/jobs/nuvo-recruitment/ | https://nuvo.ie/ | https://www.laoistoday.ie/2022/10/17/business-briefing-a-laois-company-specialising-in-healthcare-recruitment-latest-news-and-supports/;Allied Health Professionals, Care & Healthcare, Social Care
Laois;R C F Logistics Ltd;;Unit B11 National Enterprise Park Portlaoise Co. Laois;EA5388;353872805920;info@rcflogistics.ie;https://rcflogistics.ie | https://rcflogistics.in/;Logistics & Warehousing, Supply Chain
Limerick;AAP Aviation Ireland Ltd;AAP Aviation Ltd;Suite A2 No. 1 Charlotte Quay Co. Limerick;EA5199;;cc@aapaviation.com | contact@aapaviation.com | post@aapaviation.com;https://aire.aero/members/aap-aviation/ | https://jobs.aapaviation.com/locations/ireland/ | https://www.aapaviation.com/ | https://www.irishaviationresearchinstitute.ie/fly4airlines-and-aap-aviation-announce-partnership/;Aviation
Limerick;Allskillrecruitment;;24 Crestwood Kilteragh Dooradoyle Co. Limerick;EA5303;+35361468891 | +35361557160 | +353852715419;newcastlewest@welfare.ie | recruitment@limerick.ie;https://www.cpl.com/Limerick-Recruitment-jobs;General Recruitment, International Staffing
Limerick;Assist Personnel Ltd;;1 O'Curry Street Co. Limerick;EA4291;+35361310414 | +35361316517 | +35361317500;;https://assist.org/ | https://www.simplyhired.ie/search?q=assist+personnel+ltd&l=limerick%2C+county+limerick;General Recruitment
Limerick;Barracuda Recruitment Limited;Barracuda Recruitment;16 Rosehill O'Callaghan Strand Co. Limerick V94H5RF;EA4660;353870627957;info@barracudarecruitment.ie | keith@barracudarecruitment.ie;https://barracudarecruitment.ie/;Accounting & Finance
Limerick;BDO HR and Recruitment;BDO Recruitment;103/104 O'Connell Street Co. Limerick V94AT85;EA1039;+35314370654 | +35314700000 | +35361214200 | +35361414455;hrmd@bdo.com.ph | jobcontact@bdorecruitment.com | recruitment@bdo.com.ph | recruitmentnorthernluzon@bdo.com.ph | vismin@bdo.com.ph;https://bdorecruitment.com | https://bdorecruitment.ie/ | https://www.bdo.ie/en-gb/careers;Accounting & Finance
Limerick;Charlene Cooke Healthcare Limited;;68 O'Connell Street Co. Limerick V94YNP7;EA5293;35361540951;;https://cchrecruitment.ie | https://www.signalhire.com/companies/charlene-cooke-healthcare-recruitment;Care & Healthcare
Limerick;Clinical 24 Staffing Ltd;Clinical 24 Staffing Ltd;Ducart Suite Castletroy Park Commercial Campus Plassey Park Road, Castletroy Co. Limerick;EA4537;35361531494;lorna.braniff@clinical24ni.co.uk;https://medvocation.com/en/clinical24-ireland | https://reviewbritain.com/limerick/380914-clinical24-staffing-ltd | https://www.clinical24.co.uk/ | https://www.clinical24.ie/;Care & Healthcare, Allied Health Professionals
Limerick;Curran Healthcare LTD;Curran Healthcare;59/60 O Connell Street Limerick Co. Limerick;EA5257;;curranmedical.info@gmail.com | info@curranscientific.com | office@johncurranplasticsurgery.com;http://www.johncurranplasticsurgery.com/practice | https://curranmedicalcentre.ie/ | https://curranscientific.com | https://www.curranalu.ie/project_category/health/page/2/;Care & Healthcare
Limerick;Elite Talent Hub Ltd;;The Red Church Henry Street Co. Limerick V94XY20;EA5032;353858430040;info@elitetalenthub.ie | info@limerickchamber.ie | m.maccurtain@limerickchamber.ie;https://avalanchedesigns.ie/elitetalenthub | https://ul.ie | https://www.elitetalenthub.ie/;Engineering, Construction, Care & Healthcare, Commercial, Industrial, Business Services
Limerick;Financial & Technical Recruitment Ltd;;4 The Crescent O'Connell St Co. Limerick Y94YKF7;EA3948;+35361444246 | +353878194750;andrew@financialrecruitment.ie | info@ftrecruitment.ie;http://ftrecruit.com/ | https://financialrecruitment.ie | https://ftrecruitment.ie;Accounting & Finance
Limerick;Harmonics Career Crafting Ltd;;Mary Rosse Centre Holland Road National Technology Park Co. Limerick;EA3454;35361336136;fiachra@harmonics.ie | info@harmonics.ie;https://Limerick.ie | https://harmonics.ie;Career Development
Limerick;Holistic Recruitment;Holistic Recruitment;60 The Paddocks Newcastle West Co. Limerick;EA5364;+35361207900 | +35361435750;franklin@emeycare.co.uk | info@careerwise.ie | leeann@harmonics.ie | mary@emeycare.co.uk;https://careerwise.ie/about-us/recruitment-agencies-limerick/ | https://hartleypeople.com/recruitment-agency-limerick/ | https://www.elitetalenthub.ie/ | https://www.frsrecruitment.com/office-locations/limerick | https://www.harmonics.ie/recruitment/ | https://www.holistx.io/service | https://www.psgroupltd.com/about/our-team/ | https://www.recruiters.org.uk/industry/holistic;General Recruitment
Limerick;Kaph Kaph Care Agency Limited;;Cornmarket Row Penthouse Floor Co. Limerick V94FVH4;EA4879;35361579147;info@kaphcare.com;https://kaphcare.com;Care & Healthcare
Limerick;Kare Rewards Healthcare Ltd;;21 Cluainin Tullyvarraga Shannon Co. Limerick;EA4823;35361365887;admin@karerewards.ie | manager@karerewards.ie;https://karerewards.ie/ | https://www.karerewards.co.uk/ | https://www.karerewards.com/;Care & Healthcare
Limerick;Lyragh Limited;Red D;Suite 4C Whitethorns Briarfield Castletroy Co. Limerick V94 88H7;EA4903;+35316614377 | +353214232400;jobs@redd.ie;https://aeroleads.com/list/top-manufacturing-companies-in-limerick | https://redd.ie | https://www.openstreetmap.org/relation/6083444 | https://www.townlands.ie/cork/orrery-and-kilmore/kilbolane/milford/lyragh/;General Recruitment
Limerick;Martina Quinn Limited;Martina Quinn Finance Recruitment;68 O'Connell Street Co. Limerick V94 YNP7;EA4786;+35361435750 | +35361540941 | +353879190523;;https://bit.ly/3R3gF5j | https://mqrecruitment.ie | https://www.tradeford.com/ie994883/;Accounting & Finance
Limerick;Recruitworld Employment Placement Limited;;62 Parnell Street Co. Limerick V94 HX71;EA3921;353899564858;info@recruitworld.eu;https://RecruitWorld.eu | https://www.recruitment10.com/IE/Limerick/1712217309074760/Recruitworld-Employment-Placement-Ltd | https://www.recruitworld.in/;General Recruitment
Limerick;SSA Recruitment (Ireland) Limited;;Suite 307 The Gallery The Old Savoy Complex Co. Limerick V94 VY47;EA3627;35361579993;dan@ssaltd.com | jenna.hislop@ssaltd.com;https://www.ssaltd.com/;Engineering, Construction, Electrical, Quantity Surveyors
Limerick;Unijobs DAC;Unijobs DAC;9th Floor Riverpoint Lower Mallow St Co. Limerick V94 WC6A;EA3690;35361234300;grainne.mullane@unijobs.ie | jane.doe@unijobs.ie;https://unijobs.ie;Care & Healthcare, Education
Limerick;Windmill Homecare Ltd;WHC Recruitment;4 St Marys Terrace Askeaton Co. Limerick V94Y9N4;EA4803;;care@windmillhealthcare.ie | homecarecork@windmillgroup.ie | hr.homecare@windmillgroup.ie | hr@windmillgroup.ie;https://hcci.ie/find-care-near-me/munster/county-limerick/ | https://windmillgroup.ie | https://windmillhealthcare.ie/ | https://www.windmillhomecare.ie;Care & Healthcare
